{
  "schema_id": "https://gsd.local/schemas/runtime-evidence/m016-s05-seven-division-replay-producer-protocol.v1.json",
  "schema_version": "v1",
  "protocol_id": "m016-s05-seven-division-replay-producer-protocol-v1",
  "protocol_kind": "seven-division-evidence-replay-producer-protocol",
  "milestone": "M016-txa3vu",
  "slice": "S05",
  "task": "T02",
  "generated": "2026-07-20T12:00:00.000Z",
  "line_class": "M16-S05-REPLAY",
  "canonical_protocol": "PROTOCOL-M16-S05-REPLAY-V1",
  "admission_ref": "runtime-evidence/M016-S05-seven-division-replay-admission.json",
  "input_inventory_ref": "runtime-evidence/M016-S05-seven-division-replay-input-inventory.json",
  "probe_run_ref": "runtime-evidence/M016-S05-seven-division-replay-probe-run.json",
  "bundle_ref": "runtime-evidence/M016-S05-seven-division-replay-bundle.json",
  "worksheet_ref": "runtime-evidence/M016-S05-seven-division-replay-scoring-worksheet.json",
  "records_count": 19,
  "replay_keys": {
    "first_run_provenance_hash": "491cf9ec6400cfd81396fe4992a8815b72085ab32227c50ea396537a56c3a221",
    "second_run_provenance_hash": "491cf9ec6400cfd81396fe4992a8815b72085ab32227c50ea396537a56c3a221",
    "match": true,
    "byte_identical": true,
    "replay_key": "8083b52126ee297cd575d72cd393f57b880384ac678aa6324f35d49d8694b04d",
    "verified_at": "2026-07-20T12:00:00.000Z"
  },
  "verdicts": {
    "orchestration": "NOT_PROVEN",
    "evidence": "PARTIAL",
    "launch": "PREPARATION_ONLY"
  },
  "blockers": []
}